<?xml version="1.0" encoding="UTF-8"?>
<cv24:cv24 xmlns:cv24="http://univ.fr/cv24" xmlns:xsi="http://www.w3.org/2001/XMLSchema-instance" xsi:schemaLocation="http://univ.fr/cv24 cv24.tp1.xsd ">
  <identite>
    <genre>M.</genre>
    <nom>NOM</nom>
    <prenom>prenom</prenom>
    <tel>0765432100</tel>
  </identite>
  <objectif statut="stage">objectif</objectif>
  <prof>
    <detail>
      <datedeb>2001-01-01</datedeb>
      <titre>titre</titre>
    </detail>
  </prof>
  <competences>
    <diplome niveau="3">
      <date>2001-01-01</date>
    </diplome>
    <certif>
      <datedeb>2001-01-01</datedeb>
      <titre>titre</titre>
    </certif>
  </competences>
  <divers>
    <lv cert="MAT" lang="it"/>
    <autre comment="" titre="">autre</autre>
  </divers>
</cv24:cv24>
