<?xml version="1.0" encoding="UTF-8"?>
<cv24:cv24 xmlns:cv24="http://univ.fr/cv24" xmlns:xsi="http://www.w3.org/2001/XMLSchema-instance" xsi:schemaLocation="http://univ.fr/cv24 ../tp_resources/cv24.tp1.xsd ">
  <cv24:identite>
    <cv24:genre>Mme</cv24:genre>
    <cv24:nom>THIBERVILLE</cv24:nom>
    <cv24:prenom>Malvina</cv24:prenom>
    <cv24:tel>0212345678</cv24:tel>
    <cv24:mel>nomprenom@gmail.com</cv24:mel>
  </cv24:identite>
  <cv24:objectif statut="stage">Stage</cv24:objectif>
  <cv24:prof>
    <cv24:detail>
      <cv24:titre>Développement web</cv24:titre>
      <cv24:datedeb>2021-01-19</cv24:datedeb>
    </cv24:detail>
    <cv24:detail>
      <cv24:titre>Développement .NET</cv24:titre>
      <cv24:datedeb>2022-06-29</cv24:datedeb>
      <cv24:datefin>2022-12-29</cv24:datefin>
    </cv24:detail>
  </cv24:prof>
  <cv24:competences>
    <cv24:diplome niveau="4">
      <cv24:titre>Bac</cv24:titre>
      <cv24:date>2019-07-20</cv24:date>
      <cv24:institut>LAY</cv24:institut>
    </cv24:diplome>
    <cv24:diplome niveau="6">
      <cv24:titre>Licence info</cv24:titre>
      <cv24:date>2023-06-15</cv24:date>
      <cv24:institut>Université Rouen Normandie</cv24:institut>
    </cv24:diplome>
    <cv24:certif>
      <cv24:datedeb>2015-04-09</cv24:datedeb>
      <cv24:titre>Scrum Master</cv24:titre>
    </cv24:certif>
    <cv24:certif>
      <cv24:datedeb>2018-03-22</cv24:datedeb>
      <cv24:datefin>2019-03-22</cv24:datefin>
      <cv24:titre>PSC1</cv24:titre>
    </cv24:certif>
  </cv24:competences>
  <cv24:divers>
    <cv24:lv cert="MAT" lang="fr"/>
    <cv24:lv cert="CLES" nivs="B1" lang="en"/>
    <cv24:lv cert="TOEIC" nivi="620" lang="en"/>
    <cv24:autre comment="B" titre="Permis de conduire"/>
  </cv24:divers>
</cv24:cv24>
