<?xml version="1.0" encoding="UTF-8"?>
<cv24:competences xmlns:cv24="http://univ.fr/cv24" xmlns:xsi="http://www.w3.org/2001/XMLSchema-instance" xsi:schemaLocation="http://univ.fr/cv24 cv24.tp1.xsd ">
  <diplome niveau="0">
    <date>2001-01-01</date>
    <institut>institut</institut>
  </diplome>
  <certif>
    <datedeb>2001-01-01</datedeb>
    <datefin>2001-01-01</datefin>
    <titre>titre</titre>
  </certif>
</cv24:competences>
