<?xml version="1.0" encoding="UTF-8"?>
<cv24:cv24 xmlns:cv24="http://univ.fr/cv24" xmlns:xsi="http://www.w3.org/2001/XMLSchema-instance" xsi:schemaLocation="http://univ.fr/cv24 cv24.tp1.xsd ">
  <identite>
    <genre>M.</genre>
    <genre>Mme</genre>
    <prenom>prenom</prenom>
    <nom>nom</nom>
    <tel>tel</tel>
    <mel>mauvaismel.com</mel>
  </identite>
  <objectif statut="stage">objectif</objectif>
  <prof>
    <detail>
      <datedeb>2001-01-01</datedeb>
      <titre>titre</titre>
    </detail>
  </prof>
  <competences>
  	<certif>
      <titre>titre</titre>
      <datedeb>2001-01-01</datedeb>
    </certif>
    <diplome niveau="3">
      <date>date</date>
    </diplome>
  </competences>
  <divers>
    <lv cert="CLES" lang="eng" nivs="B2"/>
    <autre comment="" titre="">autre</autre>
  </divers>
</cv24:cv24>
