<?xml version="1.0" encoding="UTF-8"?>
<cv24:cv24 xmlns:cv24="http://univ.fr/cv24" xmlns:xsi="http://www.w3.org/2001/XMLSchema-instance" xsi:schemaLocation="http://univ.fr/cv24 cv24.tp1.xsd ">
  <cv24:identite>
    <cv24:genre>M.</cv24:genre>
    <cv24:nom>cv24:nom</cv24:nom>
    <cv24:prenom>cv24:prenom</cv24:prenom>
    <cv24:tel>cv24:tel</cv24:tel>
  </cv24:identite>
  <cv24:objectif statut="stage">cv24:objectif</cv24:objectif>
  <cv24:prof>
    <cv24:detail>
      <cv24:datedeb>2001-01-01</cv24:datedeb>
      <cv24:titre>cv24:titre</cv24:titre>
    </cv24:detail>
  </cv24:prof>
  <cv24:competences>
    <cv24:diplome niveau="3">
      <cv24:date>2001-01-01</cv24:date>
    </cv24:diplome>
    <cv24:certif>
      <cv24:datedeb>2001-01-01</cv24:datedeb>
      <cv24:titre>cv24:titre</cv24:titre>
    </cv24:certif>
  </cv24:competences>
  <cv24:divers>
    <cv24:lv cert="MAT" lang="" nivi="0" nivs="A1"/>
    <cv24:autre comment="" titre="">cv24:autre</cv24:autre>
  </cv24:divers>
</cv24:cv24>
