<?xml version="1.0" encoding="UTF-8"?>
<cv24:cv24 xmlns:cv24="http://univ.fr/cv24" xmlns:xsi="http://www.w3.org/2001/XMLSchema-instance" xsi:schemaLocation="http://univ.fr/cv24 cv24.tp1.xsd ">
  <cv24:identite>
    <cv24:genre>Mme</cv24:genre>
    <cv24:nom>THIBERVILLE</cv24:nom>
    <cv24:prenom>Malvina</cv24:prenom>
  </cv24:identite>
  <cv24:objectif statut="stage">Stage</cv24:objectif>
  <cv24:competences>
    <cv24:diplome niveau="4">
      <cv24:titre>Bac</cv24:titre>
      <cv24:date>2019-07-20</cv24:date>
    </cv24:diplome>
    <cv24:diplome niveau="6">
      <cv24:titre>Licence info</cv24:titre>
      <cv24:date>2023-06-15</cv24:date>
    </cv24:diplome>
  </cv24:competences>
</cv24:cv24>
